{
  "schema": "rafaelia.intent.v1",
  "intent_id": "hamread001",
  "action": "git.readonly_probe",
  "target": {
    "repo_path": ".",
    "branch": null,
    "ref": null
  },
  "inputs": [],
  "constraints": [
    {"key": "read_only", "value": true},
    {"key": "max_output_bytes", "value": 1048576}
  ],
  "evidence_refs": [],
  "requested_capabilities": ["git.read", "git.diff"],
  "risk": "low",
  "execution_gate": "allow",
  "created_at": "2026-07-22T12:00:00Z",
  "source_bundle_id": "HAM-20260722-TERMUXREAD001"
}
